Parameter,Type,Min,Max,Default,Description,Example
Cost_To_Consumer,float,0,999999,10,The unit cost per vector control (unamortized).,[link](../json/campaign-outdoorrestkill-cost-to-consumer.json)
Disqualifying_Properties,array of strings,NA,NA,[],"A list of **NodeProperty** key:value pairs that cause an intervention to be aborted (persistent interventions will stop being distributed to nodes with these values). See [IndividualProperties and NodeProperties](parameter-demographics.md#nodeproperties-and-individualproperties) parameters for more information. Generally used to control the flow of health care access. For example, to prevent the same individual from accessing health care via two different routes at the same time.",[link](../json/campaign-outdoorrestkill-disqualifying-properties.json)
Dont_Allow_Duplicates,boolean,0,1,0,Prevents individual from receiving a new intervention with the same Intervetion_Name.,[link](../json/campaign-outdoorrestkill-dont-allow-duplicates.json)
Insecticide_Name,string,NA,NA,UNINITIALIZED STRING,"The name of the insecticide defined in  the configuration parameter **Insecticides**  for this intervention.  If insecticides are being used,  this must be defined as one of those values; if they are not being used this can be empty.  It cannot have a value if you did not configure the configuration parameter **Insecticides**.",[link](../json/campaign-outdoorrestkill-insecticide-name.json)
Intervention_Name,string,NA,NA,OutdoorRestKill,"The optional name used to refer to this intervention. If two interventions of this class have different Intervention_Name values, this allows them to co-exist in the node. Otherwise the new intervention replaces the existing one.",[link](../json/campaign-outdoorrestkill-intervention-name.json)
Killing_Config,json object,NA,NA,NA,The configuration for the effects of killing of the targeted stage. Specify how this effect decays over time using one of the [Waning effect classes](parameter-campaign-waningeffects.md).,[link](../json/campaign-outdoorrestkill-killing-config.json)
New_Property_Value,string,NA,NA,"""""",An optional **NodeProperty** key:value pair that will be assigned when the intervention is applied. See [IndividualProperties and NodeProperties](parameter-demographics.md#nodeproperties-and-individualproperties) parameters for more information.,[link](../json/campaign-outdoorrestkill-new-property-value.json)
